{
  "status": "example_status",
  "invalidatedAtTime": "2024-06-15T12:00:00Z",
  "dateCreated": "2024-06-15T12:00:00Z",
  "dateModified": "2024-06-15T12:00:00Z",
  "id": "550e8400-e29b-41d4-a716-446655440000",
  "name": "example_p-name",
  "description": "example_iption",
  "hasAgriParcel": "550e8400-e29b-41d4-a716-446655440000",
  "cropSpecies": "example_pecies",
  "growth_stage": "example__stage"
}